{
  "id": "health_institution",
  "title": "Notifiable disease monitoring brief for health institutions",
  "question": "Which notifiable viral and bacterial diseases reported in Switzerland and Liechtenstein changed most in 2025 compared with 2019, and what do monitoring staff need to know before acting on those changes?",
  "needs_roles": [
    "time",
    "measure",
    "place"
  ],
  "period_type": "year",
  "years": [
    2021,
    2025
  ],
  "reference_year": 2019,
  "geography": "CHFL",
  "measures_preferred": [
    "cases",
    "consultations"
  ],
  "compare_by": "pathogen_class",
  "classes_in_main_comparison": [
    "viral",
    "bacterial"
  ],
  "exclude_from_group_totals": [
    "covid19",
    "aids"
  ],
  "outputs": [
    "headline",
    "group_totals",
    "group_index",
    "excluded",
    "quality",
    "sources"
  ],
  "index_base_year": 2019,
  "sensitivity_exclude": [
    "influenza"
  ],
  "source_priority": [
    "mandatory_reporting_system",
    "sentinella_reporting_system"
  ],
  "group_source_systems": [
    "mandatory_reporting_system"
  ],
  "dimension_filters": {
    "covid19": {
      "values": {
        "testResult": "positive"
      },
      "reason": "Explicit positive-case definition; do not infer a total from a singleton testResult."
    }
  },
  "exclusion_notes": {
    "aids": "HIV-related disease stage; excluded from group sums to avoid presenting HIV and AIDS as independent infections.",
    "covid19": "Excluded from group sums by stakeholder policy.",
    "sentinella_reporting_system": "Estimated consultations or cases remain context series; not summed with mandatory notifications."
  },
  "presentation": {
    "display_name": "Health institution",
    "layout": "dashboard",
    "detail_level": "monitoring",
    "version": "1.0"
  }
}
