{
  "id": "researcher",
  "title": "Viral vs bacterial notifiable diseases after COVID-19: technical data report",
  "question": "How have viral and bacterial notifiable infectious diseases in Switzerland and Liechtenstein developed in 2021-2025 relative to 2019, and how robust is that comparison to the selection rules and the influenza sensitivity exclusion?",
  "needs_roles": [
    "time",
    "measure",
    "place"
  ],
  "period_type": "year",
  "years": [
    2021,
    2025
  ],
  "reference_year": 2019,
  "geography": "CHFL",
  "measures_preferred": [
    "cases",
    "consultations"
  ],
  "compare_by": "pathogen_class",
  "classes_in_main_comparison": [
    "viral",
    "bacterial"
  ],
  "exclude_from_group_totals": [
    "covid19",
    "aids"
  ],
  "outputs": [
    "headline",
    "group_index",
    "group_totals",
    "small_multiples",
    "change_table",
    "excluded",
    "quality",
    "sources"
  ],
  "index_base_year": 2019,
  "sensitivity_exclude": [
    "influenza"
  ],
  "source_priority": [
    "mandatory_reporting_system",
    "sentinella_reporting_system"
  ],
  "group_source_systems": [
    "mandatory_reporting_system"
  ],
  "dimension_filters": {
    "covid19": {
      "values": {
        "testResult": "positive"
      },
      "reason": "Explicit positive-case definition; do not infer a total from a singleton testResult."
    }
  },
  "exclusion_notes": {
    "aids": "HIV-related disease stage; excluded from group sums to avoid presenting HIV and AIDS as independent infections.",
    "covid19": "Excluded from group sums by stakeholder policy.",
    "sentinella_reporting_system": "Estimated consultations or cases remain context series; not summed with mandatory notifications."
  },
  "presentation": {
    "display_name": "Researcher",
    "layout": "technical",
    "detail_level": "full",
    "version": "1.0"
  }
}
